<?xml version="1.0" encoding="UTF-8"?>
<Amandman xmlns="http://www.ftn.uns.ac.rs/amandman"
    xmlns:xsi="http://www.w3.org/2001/XMLSchema-instance"
    xsi:schemaLocation="http://www.ftn.uns.ac.rs/amandman file:/C:/Users/Milos/Documents/busep/schema/amandman.xsd">
    <Kome>
        <Naslov></Naslov>
        <Informacije>
            <NazivPropisaKojiSeMenja></NazivPropisaKojiSeMenja>
            <BrojSluzbenogGlasilaUKojemJeObjavljenOsnovniTekst></BrojSluzbenogGlasilaUKojemJeObjavljenOsnovniTekst>
        </Informacije>
    </Kome>
    <Opis>
        <Naslov></Naslov>
    </Opis>
    <Obrazlozenje>
        <Naslov></Naslov>
        <TekstObrazlozenja></TekstObrazlozenja>
    </Obrazlozenje>
    <Predlagac>
        <Funkcija></Funkcija>
        <Naziv></Naziv>
    </Predlagac>
</Amandman>